{
  "schemaVersion": 1,
  "version": "1.0.0",
  "reviewedAt": "2026-10-29",
  "reviewAfter": "2026-11-29",
  "reviewedOn": "29 October 2026",
  "freshRenewal": "unknown",
  "availability": "verified-limited",
  "cycleStatus": "archived",
  "coverage": "Scanned photograph and signature format and byte-range checks only.",
  "limitations": [
    "2026 specifications only. Do not apply these limits to 2027.",
    "Live camera capture is a separate official workflow and cannot be replaced by this image tool.",
    "No eligibility, document authenticity, face detection or portal acceptance assessment."
  ],
  "manualChecks": [
    "Use your own recent photograph, with the required white background and face visibility; check the bulletin for all content conditions.",
    "Inspect your signature for clarity and correct orientation.",
    "Complete any required live-photo capture on the official portal."
  ],
  "id": "neet-ug-images-2026",
  "name": "NEET UG · photograph and signature",
  "portal": "NEET UG",
  "cycle": "2026",
  "applicationPath": "2026 application · scanned photograph/signature only",
  "sources": [
    {
      "id": "neet-ug-images-2026-bulletin",
      "publisher": "National Testing Agency",
      "title": "NEET UG 2026 official information bulletin",
      "url": "https://cdnbbsr.s3waas.gov.in/s37bc1ec1d9c3426357e69acd5bf320061/uploads/2026/02/20260208939209382.pdf",
      "section": "Printed page 16 (PDF page 21), Upload Scanned Images, items i–ii",
      "reviewedOn": "29 October 2026",
      "verification": "verified",
      "note": "Passport photograph JPG/JPEG 10–200 KB; signature JPG/JPEG 10–100 KB. Fingerprint rules are not enabled because the bulletin contains conflicting ranges."
    }
  ],
  "imageConstraints": [
    {
      "id": "neet-ug-images-2026-photo",
      "label": "NEET UG photograph · 10–200 KB",
      "outputMime": "image/jpeg",
      "minBytes": 10240,
      "maxBytes": 204800,
      "sourceId": "neet-ug-images-2026-bulletin",
      "limitation": "Format and byte range only. Review photo content and separate live-capture instructions."
    },
    {
      "id": "neet-ug-images-2026-signature",
      "label": "NEET UG signature · 10–100 KB",
      "outputMime": "image/jpeg",
      "minBytes": 10240,
      "maxBytes": 102400,
      "sourceId": "neet-ug-images-2026-bulletin",
      "limitation": "Format and byte range only. Clarity and authenticity require your review."
    }
  ]
}
